id,name,model_id/id,group_id/id,perm_read,perm_write,perm_create,perm_unlink
real_estate_manager_access_property,Real Estate Manager Access to Property,estate.model_estate_property,estate_group_manager,1,1,1,0
real_estate_manager_access_type,Real Estate Manager Access to Type,estate.model_estate_property_type,estate_group_manager,1,1,1,1
real_estate_manager_access_tag,Real Estate Manager Access to Tag,estate.model_estate_property_tag,estate_group_manager,1,1,1,1
real_estate_manager_access_offer,Real Estate Manager Access to Offer,estate.model_estate_property_offer,estate_group_manager,1,1,1,1
real_estate_agent_access_type,Real Estate Agent Access to Type,estate.model_estate_property_type,estate_group_user,1,0,0,0
real_estate_agent_access_tag,Real Estate Agent Access to Tag,estate.model_estate_property_tag,estate_group_user,1,0,0,0
real_estate_agent_access_property,Real Estate Agent Access to Property,estate.model_estate_property,estate_group_user,1,1,1,0
real_estate_agent_access_offer,Real Estate Agent Access to Offer,estate.model_estate_property_offer,estate_group_user,1,1,1,1
